{
  "candidate_id": "MET-561392",
  "content_type": "application/json",
  "endpoint": "https://collectionapi.metmuseum.org/public/collection/v1/objects/561392",
  "error_code": null,
  "expected_accession_from_R017": "09.184.751",
  "field_verification": {
    "accessionNumber": "api_observed",
    "additionalImages": "api_observed",
    "isPublicDomain": "api_observed",
    "objectID": "api_observed",
    "objectURL": "api_observed",
    "primaryImage": "api_observed",
    "primaryImageSmall": "api_observed"
  },
  "http_status": 200,
  "identity_review": {
    "accession_aliases_adjudicated": false,
    "caveat": "No direct registered source identity or image-level, alias, edition, side, or pretraining-overlap clearance is inferred.",
    "face_and_writing_identity_confirmed": false,
    "physical_support_confirmed": false,
    "r017_literal_metadata_match_count": null,
    "source_registry_record": null
  },
  "institution": "The Metropolitan Museum of Art",
  "observed": {
    "accessionNumber": "09.184.751",
    "additionalImages": [
      "https://images.metmuseum.org/CRDImages/eg/original/LC-09_184_751_EGDP035863.jpg"
    ],
    "department": "Egyptian Art",
    "isPublicDomain": true,
    "medium": "Limestone, ink, paint",
    "objectDate": "ca. 1300–1080 BCE",
    "objectID": 561392,
    "objectName": "Ostracon, hieratic",
    "objectURL": "https://www.metmuseum.org/art/collection/search/561392",
    "period": "New Kingdom, Ramesside",
    "primaryImage": "https://images.metmuseum.org/CRDImages/eg/original/LC-09_184_751_EGDP035862.jpg",
    "primaryImageSmall": "https://images.metmuseum.org/CRDImages/eg/web-large/LC-09_184_751_EGDP035862.jpg",
    "title": "Hieratic ostracon"
  },
  "packet_schema_version": "1.0.0",
  "requested_object_id": 561392,
  "response_body_bytes": 1799,
  "response_body_sha256": "6b9499da2e3f704ba949899a15465f90775f9eaf84bfd081452c6da5f60df424",
  "retrieved_at": "2026-10-08T20:04:54Z",
  "rights_assessment": {
    "api_is_public_domain": true,
    "benchmark_independence_cleared": false,
    "diplomatic_hieratic_gold_present": false,
    "exact_original_image_eligibility": "unresolved_until_exact_view_bytes_and_asset_scope_are_verified",
    "independent_text_permission_verified": false,
    "museum_policy_url": "https://www.metmuseum.org/hubs/open-access",
    "original_image_bytes_obtained": false,
    "original_image_sha256": null,
    "policy_scope_observation": "Met states public-domain artwork images and basic collection data are CC0; this is not independent item-rights adjudication",
    "training_admission": "BLOCKED_METADATA_ONLY"
  },
  "verification_status": "verified_api_response_identity_and_schema"
}
